{
 "author": [],
 "title": [
  "The Mayflower Compact"
 ],
 "language": [
  "en"
 ],
 "theme": [
  "F001",
  "Massachusetts -- History -- New Plymouth, 1620-1691 -- Sources",
  "Pilgrims (New Plymouth Colony)",
  "Mayflower Compact (1620)"
 ],
 "id": "7",
 "genre": [
  "history"
 ],
 "text": "All of the original Project Gutenberg Etexts from the\n1970's were produced in ALL CAPS, no lower case.  The\ncomputers we used then didn't have lower case at all.\n\n***\n\nThese original Project Gutenberg Etexts will be compiled into a\nfile\ncontaining them all, in order to improve the content ratios of\nEtext\nto header material.\n\n***\n\n\nThe Mayflower Compact\n\nNovember 11, 1620  [This was November 21, old style calendar]\n\nIn the name of God, Amen.  We, whose names are underwritten,\nthe Loyal Subjects of our dread Sovereigne Lord, King James,\nby the Grace of God, of Great Britaine, France, and Ireland,\nKing, Defender of the Faith, &c.\n\nHaving undertaken for the Glory of God, and Advancement of\nthe Christian Faith, and the Honour of our King and Country,\na Voyage to plant the first colony in the Northerne Parts\nof Virginia; doe, by these Presents, solemnly and mutually\nin the Presence of God and one of another, covenant and\ncombine ourselves together into a civill Body Politick,\nfor our better Ordering and Preservation, and Furtherance\nof the Ends aforesaid; And by Virtue hereof do enact,\nconstitute, and frame, such just and equall Laws, Ordinances,\nActs, Constitutions, and Offices, from time to time,\nas shall be thought most meete and convenient for the\nGenerall Good of the Colonie; unto which we promise\nall due Submission and Obedience.\n\nIn Witness whereof we have hereunto subscribed our names\nat Cape Cod the eleventh of November, in the Raigne of our\nSovereigne Lord, King James of England, France, and Ireland,\nthe eighteenth, and of Scotland, the fiftie-fourth,\nAnno. Domini, 1620.\n\nMr. John Carver           Mr. Stephen Hopkins\nMr. William Bradford      Digery Priest\nMr. Edward Winslow        Thomas Williams\nMr. William Brewster      Gilbert Winslow\nIsaac Allerton            Edmund Margesson\nMiles Standish            Peter Brown\nJohn Alden                Richard Bitteridge\nJohn Turner               George Soule\nFrancis Eaton             Edward Tilly\nJames Chilton             John Tilly\nJohn Craxton              Francis Cooke\nJohn Billington           Thomas Rogers\nJoses Fletcher            Thomas Tinker\nJohn Goodman              John Ridgate\nMr. Samuel Fuller         Edward Fuller\nMr. Christopher Martin    Richard Clark\nMr. William Mullins       Richard Gardiner\nMr. William White         Mr. John Allerton\nMr. Richard Warren        Thomas English\nJohn Howland              Edward Doten\nEdward Liester",
 "persons": {
  "434": "God",
  "534": "James",
  "1607": "John Carver",
  "1633": "Stephen Hopkins",
  "1773": "Isaac Allerton",
  "1799": "Edmund Margesson",
  "1816": "Miles Standish",
  "1842": "Peter Brown",
  "1854": "John Alden",
  "1880": "Richard Bitteridge",
  "1899": "John Turner",
  "1925": "George Soule",
  "1938": "Francis Eaton",
  "1964": "Edward Tilly",
  "1977": "James Chilton",
  "2003": "John Tilly",
  "2014": "John Craxton",
  "2040": "Francis Cooke",
  "2054": "John Billington",
  "2080": "Thomas Rogers",
  "2094": "Joses Fletcher",
  "2120": "Thomas Tinker",
  "2134": "John Goodman",
  "2160": "John Ridgate",
  "2177": "Samuel Fuller",
  "2199": "Edward Fuller",
  "2217": "Christopher Martin",
  "2239": "Richard Clark",
  "2257": "William Mullins",
  "2300": "William White",
  "2326": "John Allerton",
  "2381": "John Howland",
  "2407": "Edward Doten"
 },
 "locations": {
  "565": "Great Britaine",
  "581": "France",
  "593": "Ireland",
  "817": "Virginia",
  "1413": "Cape Cod",
  "1500": "England",
  "1553": "Scotland"
 },
 "organisations": {},
 "misc": {
  "20": "Project Gutenberg Etexts",
  "38": "Etext",
  "337": "Mayflower Compact",
  "699": "Christian"
 }
}